{
  "$schema": "https://bloktastic.com/schema/registry.schema.json",
  "name": "bloktastic",
  "version": "1.0.0",
  "homepage": "https://bloktastic.com",
  "repository": "https://github.com/bartundmett/bloktastic",
  "packages": {
    "components": [
      {
        "name": "@bloktastic/accordion",
        "path": "components/accordion",
        "version": "1.0.0",
        "title": "Accordion",
        "description": "Expandable accordion component for FAQs, feature details, and progressive disclosure content.",
        "tags": [
          "accordion",
          "faq",
          "content",
          "expandable"
        ],
        "category": "content",
        "status": "stable"
      },
      {
        "name": "@bloktastic/accordion-item",
        "path": "components/accordion-item",
        "version": "1.0.0",
        "title": "Accordion Item",
        "description": "Single item for accordion content with title, rich text body, and optional icon.",
        "tags": [
          "accordion",
          "item",
          "faq",
          "content"
        ],
        "category": "content",
        "status": "stable"
      },
      {
        "name": "@bloktastic/announcement-bar",
        "path": "components/announcement-bar",
        "version": "1.0.0",
        "title": "Announcement Bar",
        "description": "Slim top banner for product announcements, campaign messages, and urgent notices.",
        "tags": [
          "banner",
          "announcement",
          "marketing",
          "header"
        ],
        "category": "sections",
        "status": "stable"
      },
      {
        "name": "@bloktastic/blog-grid",
        "path": "components/blog-grid",
        "version": "1.0.0",
        "title": "Blog Grid",
        "description": "Recent articles section with teaser cards for content marketing pages.",
        "tags": [
          "blog",
          "articles",
          "content",
          "teasers"
        ],
        "category": "sections",
        "status": "stable"
      },
      {
        "name": "@bloktastic/button",
        "path": "components/button",
        "version": "1.0.0",
        "title": "Button",
        "description": "Versatile call-to-action button with variants, sizes, icon support, and accessible states.",
        "tags": [
          "button",
          "cta",
          "action",
          "ui"
        ],
        "category": "content",
        "status": "stable"
      },
      {
        "name": "@bloktastic/contact-section",
        "path": "components/contact-section",
        "version": "1.0.0",
        "title": "Contact Section",
        "description": "Contact form section with heading, descriptive text, and configurable fields.",
        "tags": [
          "contact",
          "form",
          "lead",
          "support"
        ],
        "category": "forms",
        "status": "stable"
      },
      {
        "name": "@bloktastic/cta-banner",
        "path": "components/cta-banner",
        "version": "1.0.0",
        "title": "CTA Banner",
        "description": "Call-to-action section with compact copy, button, and optional supporting text.",
        "tags": [
          "cta",
          "banner",
          "conversion",
          "action"
        ],
        "category": "sections",
        "status": "stable"
      },
      {
        "name": "@bloktastic/faq-section",
        "path": "components/faq-section",
        "version": "1.0.0",
        "title": "FAQ Section",
        "description": "Frequently asked questions wrapper with optional intro and nested accordion block.",
        "tags": [
          "faq",
          "questions",
          "support",
          "accordion"
        ],
        "category": "sections",
        "status": "stable"
      },
      {
        "name": "@bloktastic/feature-grid",
        "path": "components/feature-grid",
        "version": "1.0.0",
        "title": "Feature Grid",
        "description": "Marketing feature section with heading and nested feature items in responsive columns.",
        "tags": [
          "features",
          "grid",
          "benefits",
          "marketing"
        ],
        "category": "sections",
        "status": "stable"
      },
      {
        "name": "@bloktastic/feature-item",
        "path": "components/feature-item",
        "version": "1.0.0",
        "title": "Feature Item",
        "description": "Reusable feature item with icon, title, and short description for feature grids.",
        "tags": [
          "feature",
          "item",
          "benefit",
          "card"
        ],
        "category": "content",
        "status": "stable"
      },
      {
        "name": "@bloktastic/footer",
        "path": "components/footer",
        "version": "1.0.0",
        "title": "Footer",
        "description": "Multi-column footer with branding, navigation groups, legal text, and socials.",
        "tags": [
          "footer",
          "navigation",
          "legal",
          "links"
        ],
        "category": "navigation",
        "status": "stable"
      },
      {
        "name": "@bloktastic/hero",
        "path": "components/hero",
        "version": "1.0.0",
        "title": "Hero Section",
        "description": "Full-width hero section with headline, rich description, background media, and CTA actions.",
        "tags": [
          "hero",
          "landing",
          "banner",
          "section"
        ],
        "category": "sections",
        "status": "stable"
      },
      {
        "name": "@bloktastic/image",
        "path": "components/image",
        "version": "1.0.0",
        "title": "Image",
        "description": "Responsive image component with aspect ratio controls, caption, and lazy loading options.",
        "tags": [
          "image",
          "media",
          "responsive",
          "caption"
        ],
        "category": "media",
        "status": "stable"
      },
      {
        "name": "@bloktastic/logo-cloud",
        "path": "components/logo-cloud",
        "version": "1.0.0",
        "title": "Logo Cloud",
        "description": "Trusted-by logo section to showcase customers, partners, and integrations.",
        "tags": [
          "logos",
          "social-proof",
          "partners",
          "brands"
        ],
        "category": "sections",
        "status": "stable"
      },
      {
        "name": "@bloktastic/navbar",
        "path": "components/navbar",
        "version": "1.0.0",
        "title": "Navbar",
        "description": "Responsive navigation header with logo text, menu links, CTA, and mobile-friendly behavior.",
        "tags": [
          "navbar",
          "navigation",
          "header",
          "menu"
        ],
        "category": "navigation",
        "status": "stable"
      },
      {
        "name": "@bloktastic/newsletter-section",
        "path": "components/newsletter-section",
        "version": "1.0.0",
        "title": "Newsletter Section",
        "description": "Email capture section for newsletter subscriptions and lead generation.",
        "tags": [
          "newsletter",
          "email",
          "lead",
          "signup"
        ],
        "category": "forms",
        "status": "stable"
      },
      {
        "name": "@bloktastic/pricing-section",
        "path": "components/pricing-section",
        "version": "1.0.0",
        "title": "Pricing Section",
        "description": "Pricing block with nested pricing tiers and optional comparison context.",
        "tags": [
          "pricing",
          "plans",
          "conversion",
          "saas"
        ],
        "category": "sections",
        "status": "stable"
      },
      {
        "name": "@bloktastic/pricing-tier",
        "path": "components/pricing-tier",
        "version": "1.0.0",
        "title": "Pricing Tier",
        "description": "Single pricing card tier with plan name, price, features, and CTA settings.",
        "tags": [
          "pricing",
          "tier",
          "plan",
          "saas"
        ],
        "category": "commerce",
        "status": "stable"
      },
      {
        "name": "@bloktastic/stat-item",
        "path": "components/stat-item",
        "version": "1.0.0",
        "title": "Stat Item",
        "description": "Single KPI/stat block for metrics such as growth, users, and performance.",
        "tags": [
          "stats",
          "kpi",
          "metric",
          "numbers"
        ],
        "category": "content",
        "status": "stable"
      },
      {
        "name": "@bloktastic/stats-section",
        "path": "components/stats-section",
        "version": "1.0.0",
        "title": "Stats Section",
        "description": "Section for key metrics and KPIs with nested stat items.",
        "tags": [
          "stats",
          "kpi",
          "metrics",
          "social-proof"
        ],
        "category": "sections",
        "status": "stable"
      },
      {
        "name": "@bloktastic/team-grid",
        "path": "components/team-grid",
        "version": "1.0.0",
        "title": "Team Grid",
        "description": "Team showcase section with nested team member cards.",
        "tags": [
          "team",
          "about",
          "people",
          "company"
        ],
        "category": "sections",
        "status": "stable"
      },
      {
        "name": "@bloktastic/team-member",
        "path": "components/team-member",
        "version": "1.0.0",
        "title": "Team Member",
        "description": "Profile card for a team member with role, avatar, and optional social links.",
        "tags": [
          "team",
          "profile",
          "member",
          "about"
        ],
        "category": "content",
        "status": "stable"
      },
      {
        "name": "@bloktastic/teaser",
        "path": "components/teaser",
        "version": "1.0.0",
        "title": "Teaser Card",